IP 192.168.2.2.51514 > 142.250.183.14.443: Flags [S], seq 1, win 65535, length 0
IP 142.250.183.14.443 > 192.168.2.2.51514: Flags [S.], seq 2, ack 2, win 65535, length 0
IP 192.168.2.2.51514 > 142.250.183.14.443: Flags [.], ack 1, win 2048, length 0
IP 192.168.2.2.51515 > 142.250.183.14.443: Flags [P.], seq 1:100, ack 1, length 99
IP 192.168.2.2.49200 > 23.53.140.11.443: Flags [S], seq 5, win 65535, length 0
IP 23.53.140.11.443 > 192.168.2.2.49200: Flags [S.], seq 6, ack 6, win 65535, length 0
IP 192.168.2.2.5353 > 224.0.0.251.5353: 0 questions
IP 192.168.2.2.68 > 192.168.2.1.67: BOOTP/DHCP request
IP 8.8.8.8.53 > 192.168.2.2.55000: 12345 1/0/0 A 142.250.183.14
IP 10.0.0.5.443 > 10.0.0.9.443: Flags [S], seq 9, length 0
